{"$schema":"https://json-schema.org/draft/2020-12/schema","$id":"https://agensfield.dev/scriba/schemas/policy-validate.schema.json","title":"Scriba policy validation","type":"object","additionalProperties":false,"required":["schemaVersion","valid","file","rules"],"properties":{"schemaVersion":{"const":"scriba.policy-validate.v1"},"valid":{"type":"boolean"},"file":{"type":"string"},"preset":{"enum":["current","custom"]},"rules":{"type":"array","items":{"$ref":"#/$defs/rule"}},"errors":{"type":"array","items":{"type":"string"},"minItems":1}},"allOf":[{"if":{"properties":{"valid":{"const":true}}},"then":{"required":["preset"],"not":{"required":["errors"]}},"else":{"required":["errors"],"not":{"required":["preset"]}}}],"$defs":{"rule":{"type":"object","additionalProperties":false,"required":["id","kind"],"properties":{"id":{"type":"string"},"kind":{"enum":["remaining_checkpoint","reset_transition","grant_available","grant_expiry_checkpoint"]},"windowKeys":{"type":"array","items":{"type":"string"},"uniqueItems":true},"secondaryWindowKeys":{"type":"array","items":{"type":"string"},"uniqueItems":true},"checkpoints":{"type":"array","items":{"type":"integer"},"uniqueItems":true},"clockJitterSec":{"type":"integer","minimum":0},"dueJitterSec":{"type":"integer","minimum":0}}}}}
