{"file":"policy.json","preset":"current","rules":[{"checkpoints":[20,10,5,0],"id":"current.remaining.primary","kind":"remaining_checkpoint","windowKeys":["primary.five_hour","primary.weekly"]},{"clockJitterSec":300,"dueJitterSec":600,"id":"current.reset.weekly","kind":"reset_transition","secondaryWindowKeys":["spark.weekly","review.weekly"],"windowKeys":["primary.weekly"]},{"id":"current.grant.available","kind":"grant_available"},{"checkpoints":[5,3,1],"id":"current.grant.expiry","kind":"grant_expiry_checkpoint"}],"schemaVersion":"scriba.policy-validate.v1","valid":true}
